text,category
Unë jam ende duke pritur në kartën time?,card_arrival
Çfarë mund të bëj nëse karta ime nuk ka ardhur ende pas 2 javësh?,card_arrival
Unë kam pritur më shumë se një javë. A po vjen akoma karta?,card_arrival
A mund ta gjurmoj kartën time ndërkohë që është në procesin e dorëzimit?,card_arrival
"Si mund ta di nëse do ta marr kartën time, apo nëse ajo ka humbur?",card_arrival
Kur ma dërgove kartën time të re?,card_arrival
A keni informacion për kartën në dorëzim?,card_arrival
Çfarë duhet të bëj nëse ende nuk e kam marrë kartën time të re?,card_arrival
A ka paketa me kartën time gjurmim?,card_arrival
"Kam porositur kartën time, por ende nuk është këtu",card_arrival
Pse nuk ka ardhur ende karta ime e re?,card_arrival
"Ende nuk e kam marrë kartën pas dy javësh, a ka humbur?",card_arrival
Mund të gjurmoni kartën time për mua?,card_arrival
A ka ndonjë mënyrë për të gjurmuar dorëzimin e kartës sime?,card_arrival
Ka një javë që kam porositur kartën time dhe nuk është këtu. Ju lutem ndihmë?,card_arrival
A do të jem në gjendje të gjurmoj kartën që më është dërguar?,card_arrival
Unë nuk e kam kartën time për 1 javë. A duhet të shqetësohem?,card_arrival
Si mund ta di se kur do të vijë karta ime e re?,card_arrival
Karta ime e re nuk është dorëzuar ende në shtëpinë time. Cfare po ndodh?,card_arrival
Ka një javë që më keni lëshuar një kartë dhe ende nuk e kam marrë. A duhet të vazhdoj të pres?,card_arrival
"Në kartën që po vjen, cili është informacioni i gjurmimit?",card_arrival
Cili është statusi i dorëzimit të kartës sime?,card_arrival
E ke dërguar akoma kartën time?,card_arrival
Karta ime nuk është ende këtu.,card_arrival
ku është karta ime e re?,card_arrival
Ka një javë që më dërgove kartën dhe unë ende nuk e kam.,card_arrival
Si ta gjurmoj kartën që më dërgove?,card_arrival
Kur do ta marr kartën time të re?,card_arrival
Kur do ta marr kartën time të re?,card_arrival
Cila është data e pritshme e dorëzimit për kartën time?,card_arrival
A ka një numër përcjellës për kartën që më dërgove?,card_arrival
Do të doja të gjurmoja kartën që më dërgove.,card_arrival
A ka humbur kartela ime gjatë dorëzimit?,card_arrival
Karta ime e re nuk ka hyrë.,card_arrival
Ku është karta që kam porositur 2 javë më parë?,card_arrival
A mund të marr një përditësim për kartën time të zëvendësimit?,card_arrival
Sa kohë duhet që një kartë e re të dërgohet?,card_arrival
Cili është gjurmimi në kartën që dërgove?,card_arrival
Unë nuk e kam marrë kartën time dhe jam i shqetësuar se ka humbur.,card_arrival
Karta ime ende nuk është dorëzuar,card_arrival
Më duhet të zbuloj se ku është karta që kam porositur.,card_arrival
Ku është karta ime e kreditit që do të dërgohej me postë?,card_arrival
"Kam porositur kartën time, por ende nuk është dorëzuar",card_arrival
A mund të gjurmoj kartën që sapo më është dërguar?,card_arrival
Mund të më thoni pse nuk e kam marrë kartën time të re?,card_arrival
Unë jam ende duke pritur për kartën time të re.,card_arrival
A ka humbur karta ime? Unë jam ende në pritje të dorëzimit.,card_arrival
A duhet të vazhdoj të pres që karta ime të dorëzohet?,card_arrival
A mund të gjurmoj kur do të dorëzohet karta ime?,card_arrival
Si mund të kontrolloj statusin e kartës sime të re?,card_arrival
"Më është dërguar një kartë, si ta gjurmoj?",card_arrival
A ka ndonjë mënyrë për ta përshpejtuar kartën time?,card_arrival
Çfarë mund të bëj për të gjurmuar kartën që më dërgove?,card_arrival
pse karta ime nuk ka ardhur ende?,card_arrival
Si mund ta kontrolloj periodikisht dorëzimin e kartës që keni dërguar?,card_arrival
Cila është arsyeja pse karta ime e re nuk ka ardhur?,card_arrival
Sa kohë më duhet për të marrë kartën time të re?,card_arrival
Unë nuk e kam kartën time pas 1 jave. Cilat janë hapat e mi të ardhshëm?,card_arrival
"E di që po marr një kartë të re, por do të doja të dija kur mund të pres ta marr atë.",card_arrival
Dua të zbuloj se çfarë ndodhi me kartën time të re?,card_arrival
A kishte ndonjë mënyrë që unë të merrja gjurmim për këtë?,card_arrival
Unë jam ende duke pritur për kartën time.,card_arrival
Karta ime nuk ka ardhur.,card_arrival
A mund ta gjurmoj kartën që më dërgove?,card_arrival
Nuk e kam marrë kartën time të re.,card_arrival
Sa kohë duhet që kartela ime e re të arrijë në postën e tyre? Çfarë duhet të bëj nëse nuk e marr kurrë?,card_arrival
A do të më duhet të pres shumë më gjatë që të vijë karta ime e re?,card_arrival
si të gjurmoni kartën që keni dërguar,card_arrival
2 javë më parë porosita kartën time të re. Nuk është këtu. Cfare duhet te bej?,card_arrival
Si mund të kontrolloj statusin e dorëzimit të kartës sime?,card_arrival
"Karta ime nuk është dorëzuar ende dhe ka një javë që e kam porositur, ju lutem më ndihmoni",card_arrival
Sa është koha e pritur e pritjes për të marrë kartën time të re?,card_arrival
Si mund të shoh ecurinë e dorëzimit të kartës që është dërguar?,card_arrival
"Karta ime duhej të vinte, por apo jo?",card_arrival
Kam porositur një kartë dhe do të doja të dija se si të gjurmoja përparimin e dorëzimit të saj.,card_arrival
Sa kohë do të më duhet për të marrë kartën time?,card_arrival
Karta ime nuk është shfaqur ende.,card_arrival
A ka një numër gjurmimi karta që dërguat?,card_arrival
Karta ime nuk ka ardhur ende me postë. E porosita dy javë më parë. Çfarë mund të bëj?,card_arrival
maksimumi sa dite merr korrierin?,card_arrival
A ka ndonjë arsye që karta ime e re nuk ka ardhur ende?,card_arrival
"Unë kam pritur një kohë për kartën time, a ka ndonjë mënyrë për të ditur se kur do të arrijë?",card_arrival
Si mund të gjurmoj dorëzimin e kartës sime?,card_arrival
A mund ta gjurmoj kartën që sapo më është dërguar?,card_arrival
"Nëse kam porositur kartën time të re javën e kaluar, sa kohë duhet të pres për ta marrë atë?",card_arrival
"Çfarë po ndodh, ku është karta ime e re?",card_arrival
Ku është karta ime e re nëse nuk e kam marrë ende?,card_arrival
Ku është karta ime?,card_arrival
Mund të më thoni pse nuk e kam marrë ende kartën time të re?,card_arrival
A ka ndonjë mënyrë për të gjurmuar kartën time?,card_arrival
A ka ndonjë mënyrë për të gjurmuar kartën e re që më dërgove?,card_arrival
Unë jam ende duke pritur për kartën time.,card_arrival
Çfarë duhet të bëj për të marrë kartën time të re të cilën e kam kërkuar 2 javë më parë?,card_arrival
CILA ËSHTË ZGJIDHJA E KËTIJ PROBLEMI,card_arrival
A mund të marr gjurmimin në kartë?,card_arrival
Mund të më ndihmoni të gjurmoj kartën time?,card_arrival
A nuk duhet të jetë tashmë këtu karta ime e re?,card_arrival
A ka ndonjë arsye që karta ime e re nuk ka ardhur?,card_arrival
"Do të doja të gjurmoja një kartë të dërguar tek unë, si ta bëj këtë?",card_arrival
A ka një numër përcjellës për kartën?,card_arrival
a mund të ndani numrin e përcjelljes së kartës?,card_arrival
"Unë nuk e kam marrë kartën time dhe ka një javë, çfarë të bëj?",card_arrival
A ka ndonjë mënyrë për të kontrolluar kartën në rrugën drejt meje?,card_arrival
Kur do të vijë karta ime e re?,card_arrival
Pse nuk e kam marrë ende kartën time të re?,card_arrival
Cila është data e pritshme e dorëzimit të kartës sime?,card_arrival
Karta ime nuk më ka ardhur ende me postë?,card_arrival
Unë nuk e kam marrë kartën time.,card_arrival
A është e mundur që unë të gjurmoj se karta më është dërguar me postë?,card_arrival
Kur do të dorëzohet karta ime e re?,card_arrival
Më lëshuan një kartë rreth një javë më parë. pse nuk ka ardhur akoma?,card_arrival
Ju lutem mund të më tregoni ku është karta ime? E porosita 2 javë më parë!,card_arrival
Unë ende nuk e kam marrë kartën time me postë,card_arrival
Unë jam ende duke pritur për kartën time që është lëshuar një javë më parë. Cfare duhet te bej?,card_arrival
Ende nuk e kam marrë kartën time të re. Kur do të arrijë këtu?,card_arrival
A keni një numër përcjellës për kartën që më dërguan?,card_arrival
Si ta gjurmoj kartën që më dërgove?,card_arrival
A është në rrugë e sipër karta ime e re bankare dhe a ka ndonjë mënyrë për ta gjurmuar atë?,card_arrival
A mund të më dërgoni dhe të përditësoni datën e mbërritjes së kartës sime?,card_arrival
Sa kohë duhet për të marrë kartën time të re?,card_arrival
Karta ime nuk më ka ardhur ende me postë.,card_arrival
Cili është numri i ndjekjes së kartës që më dërgove?,card_arrival
nuk e kam kartën time,card_arrival
Pse nuk ka ardhur ende karta ime?,card_arrival
Mendova se do të kisha marrë kartën time të re në këtë pikë.,card_arrival
Sa kohë derisa karta ime e re të vijë këtu?,card_arrival
Sa kohë deri sa të marr kartën time të re?,card_arrival
A mund të gjurmoj një kartë që është dërguar tashmë?,card_arrival
A është e mundur të gjurmosh kartën që më dërgove?,card_arrival
Sa kohë do të zgjasë për të marrë këtë kartë të re?,card_arrival
si mund ta gjurmoj kartën që ke dërguar,card_arrival
A mund të gjurmohet karta që më është dërguar?,card_arrival
pse nuk e kam kartën time të re?,card_arrival
Më duhet të gjurmoj kartën e dërguar tek unë.,card_arrival
"Kanë kaluar dy javë dhe nuk e kam marrë kartën time, çfarë të bëj?",card_arrival
Tani prisja kartën time të re.,card_arrival
Ku është numri i përcjelljes për kartën?,card_arrival
"Më kanë lëshuar një kartë të re një javë më parë, por ende nuk e kam marrë. Sa kohë do të kalojë derisa ta marr?",card_arrival
A mund ta gjurmoj kartën që më dërgove me postë?,card_arrival
Mund të më thoni nëse mund të gjurmoj kartën që më dërguat?,card_arrival
Pse nuk e kam marrë kartën time të re?,card_arrival
Unë jam ende duke pritur për dorëzimin e kartës time të re!,card_arrival
Karta ime e re nuk është këtu dhe është lëshuar një javë më parë.,card_arrival
"Unë duhej të merrja kartën time të re deri tani, por ajo nuk ka ardhur.",card_arrival
A disponohet një numër gjurmimi për kartën që sapo u dërgua?,card_arrival
Pse nuk e kam marrë kartën time të re?,card_arrival
A kishte ndonjë numër për të gjurmuar që mund të merrja?,card_arrival
Sa kohë do të duhet për të marrë kartën time të re?,card_arrival
Nuk e kam marrë kartën time të kreditit me postë.,card_arrival
Karta ime nuk ka ardhur ende. Çfarë të bëj?,card_arrival
"Karta ime nuk ka ardhur ende pas dy javësh, tani çfarë?",card_arrival
Karta ime duket se nuk ka ardhur kurrë?,card_arrival
Karta ime nuk erdhi kurrë.,card_arrival
Karta ime është gjetur. A ka ndonjë mënyrë që unë ta vendos përsëri në aplikacion?,card_linking
Unë arrita të gjeja kartën time. Si ta vendos në aplikacionin tim?,card_linking
si mund ta bëj që kartela ime të shfaqet në aplikacion?,card_linking
Sapo mora kartën time. Nuk është lidhur ende - si ta bëj këtë?,card_linking
"Karta e humbur u gjet, dëshiron ta kthesh përsëri në aplikacion",card_linking
"Sapo mora një kartë, si mund ta shtoj në aplikacion?",card_linking
A ka ndonjë mënyrë për të parë kartën time në aplikacion?,card_linking
"Nëse gjej një kartë që kam humbur, a duhet ta heq? Apo mund ta riaktivizoj kartën dhe të vazhdoj ta përdor?",card_linking
Kam gjetur kartën time. Si mund ta vendos në aplikacionin tim?,card_linking
Si të bëj që karta ime të shfaqet në aplikacion?,card_linking
Mund të më tregoni ku ta lidh kartën e re?,card_linking
Gjeta kartën time të vjetër. A mund ta lidh përsëri në aplikacion?,card_linking
"Më trego si të lidh kartën e re,",card_linking
Si mund të shtoj një kartë ekzistuese në aplikacion?,card_linking
Më në fund mora kartën time. Tani dua ta lidh. Është diçka që ju duhet të bëni apo mund ta bëj?,card_linking
Si mund të lidh një nga kartat tuaja që kam tashmë?,card_linking
"Nëse kam një kartë fizike, a mund ta lidh atë?",card_linking
"E gjeta kartën time të humbur në xhepin e xhaketës këtë mëngjes, kështu që do të doja ta riaktivizoja, ju lutem.",card_linking
A mund të shtoj një kartë që sapo gjeta (përsëri) në aplikacion?,card_linking
Si mund të bëj që karta ime të shfaqet në aplikacion?,card_linking
"Do të doja të riaktivizoja kartën time, më parë ishte raportuar e humbur, por e gjeta sot në mëngjes.",card_linking
"Mirë, e gjeta kartën time, a mund ta vendos përsëri në aplikacion?",card_linking
A mund të riaktivizoj një kartë?,card_linking
Do të doja të riaktivizoja një kartë dhe pyesja veten nëse mund të bëhet kjo?,card_linking
"E mora kartën time tani, si ta bëj që të shfaqet në aplikacion?",card_linking
Si të lidh një kartë ekzistuese?,card_linking
Si të lidh një kartë të re në aplikacion?,card_linking
"Karta që mendova se kishte humbur ishte vetëm në xhaketën time, kështu që a mund ta riaktivizoj atë që kur e gjeta këtë mëngjes?",card_linking
Unë tashmë kam një kartë dhe dua ta lidh atë,card_linking
Ju lutem mund të riaktivizoni kartën time?,card_linking
Ku mund të shkoj për të shtuar një kartë të re?,card_linking
Dua që karta ime që sapo mora të shfaqet në aplikacion. Si ta bëj këtë?,card_linking
"Mora kartën time, si mund ta bëj që të shfaqet në aplikacion?",card_linking
"Nëse kam një kartë krediti me ju, si mund të konfiguroj lidhjen me të?",card_linking
Si mund të shtoj kartën time të re?,card_linking
"Dua të riaktivizoj kartën time, mendova se e kisha humbur por e gjeta sërish këtë mëngjes.",card_linking
"Më duhet një riaktivizim i kartës, e kisha raportuar të humbur, por e ndesha me xhaketë.",card_linking
Karta ime nuk humbet më. Si ta fus përsëri në aplikacion?,card_linking
"Dua të riaktivizoj kartën time, mendova se e kisha humbur por e gjeta përsëri në xhaketë.",card_linking
"A mund ta riaktivizoj kartën time? Më parë e kam raportuar të humbur, por tani e kam gjetur shëndoshë e mirë.",card_linking
Si mund të riaktivizoj një kartë që mendova se e humba?,card_linking
Më ndihmo të kuptoj se si të lidh kartën e re.,card_linking
Kam gjetur kartën time të humbur. A jam ende në gjendje ta përdor?,card_linking
A do të më duhet një kartë e re apo mund ta vendos përsëri kartën time të vjetër në aplikacion?,card_linking
A ka ndonjë mënyrë për të lidhur kartën që sapo mora?,card_linking
Si mund të shtoj një kartë të re?,card_linking
"Dua të riaktivizoj kartën time, e gjeta pasi mendova se kishte humbur.",card_linking
A mund ta vendos përsëri kartën time të vjetër në aplikacion?,card_linking
"Kam marrë një kartë të re, si ta lidh atë?",card_linking
Gjeta kartën që mendova se e humba këtë mëngjes. A mund ta riaktivizoj këtë kartë?,card_linking
Si mund të bëj lidhjen e një karte të re?,card_linking
si mund ta lidh kartën,card_linking
"Unë kam një nga kartat tuaja, por nuk di si ta lidh.",card_linking
si të lidh një kartë të vjetër?,card_linking
Mora kartën time. Si ta lidh atë me aplikacionin?,card_linking
"Tani që kam kartën time, si ta lidh atë me aplikacionin?",card_linking
Si ta shtoj kartën që sapo mora për t'u shfaqur në aplikacion?,card_linking
"Dua të riaktivizoj kartën time, mendova se e kisha humbur por e gjeta.",card_linking
Çfarë duhet të bëj për të lidhur kartën time të re për llogarinë time?,card_linking
A mund të shtoj një kartë për t'u rikthyer në aplikacion?,card_linking
Unë dua të lidh kartën time të re. Mund të më ndihmoni?,card_linking
Cili është procesi për të lidhur kartën e re?,card_linking
"E gjeta kartën time, a mund ta vendos përsëri në aplikacion?",card_linking
"Kam gjetur kartën time të humbur ose të vjedhur, a do të më duhet të aktivizoj akoma kartën e re që më është dërguar përmes postës për të hyrë në llogarinë time?",card_linking
Ku mund të lidh një kartë të re?,card_linking
Si mund të shtoj një kartë në aplikacion?,card_linking
"E gjeta kartën time në xhaketën time këtë mëngjes, kështu që a mund ta riaktivizoj?",card_linking
"E kam marrë kartën, si ta aktivizoj në aplikacion?",card_linking
Më duhet të gjej kartën që kam marrë në aplikacion.,card_linking
Si mund ta marr kartën time në aplikacion?,card_linking
"Në aplikacion, si mund ta bëj të tregojë kartën e re që mbërriti?",card_linking
Si ta lidh kartën time të re?,card_linking
A mund të aktivizoj një kartë në aplikacion?,card_linking
"Dua të lidh kartën time me ju, si?",card_linking
Unë do të doja të lidh kartën time me llogarinë time.,card_linking
"Mendova se e humba kartën, kështu që e anulova, por së fundmi e gjeta në xhaketë dhe do të doja ta rivendosja kartën.",card_linking
Si mund ta lidh kartën e re?,card_linking
Kam një kartë të re dhe nuk gjej ku ta lidh.,card_linking
"Hej, unë kam kartën time, si mund ta bëj që të shfaqet në aplikacion?",card_linking
Ku mund të shkoj në aplikacion për të shfaqur kartën time të re?,card_linking
Ku ta skanoj kartën time?,card_linking
A mund ta riaktivizoj kartën time? E raportova të humbur dhe e gjeta këtë mëngjes në xhaketën time.,card_linking
A mund ta lidh kartën time që kam marrë më parë?,card_linking
"Dua të riaktivizoj kartën time, mendova se e kisha humbur por e gjeta sërish në xhaketën time këtë mëngjes.",card_linking
"Do të doja të riaktivizoja kartën time, po mendoja se ishte e gabuar, por kur u zgjova zbulova se e kisha lënë në pallto.",card_linking
Më dërgove një kartë dhe tani dua ta lidh.,card_linking
Si ta shtoj kartën time të re në aplikacion?,card_linking
A mund të shtoj një kartë përsëri në aplikacion?,card_linking
Po nëse dua të shtoj një kartë që e kam tashmë në aplikacion?,card_linking
Kohët e fundit kam raportuar kartën time si të humbur/të humbur dhe sapo e gjeta. A mund ta përdor akoma?,card_linking
"A mund ta riaktivizoj kartën time, ju lutem, nuk e gjeta, por doli se ishte në xhepin tim të xhaketës.",card_linking
A ka ndonjë mënyrë për të lidhur kartat nëse kam një nga tuajat?,card_linking
"Nëse karta ime është humbur ose vjedhur, a mund ta rilidh atë?",card_linking
Si mund të lidh një kartë të re me një ekzistuese?,card_linking
Si të lidh një kartë të re pagese?,card_linking
Dëshiroj të riaktivizoj kartën time që më parë e kam raportuar të humbur. E gjeta kartën këtë mëngjes.,card_linking
"Karta është marrë, si do të shfaqet në aplikacion?",card_linking
A mund të rilidh një kartë të humbur me aplikacionin?,card_linking
Çfarë duhet të bëj për të lidhur kartën time të re?,card_linking
A është e mundur të lidhni një kartë të re?,card_linking
"E çaktivizova kartën time, por do të doja ta riaktivizoja.",card_linking
"Gjeta kartën time që mendova se e kisha humbur, duhet ta reagoj, ju lutem më ndihmoni.",card_linking
a mund të lidh një kartë tuajën që e kam tashmë?,card_linking
A mund ta vendos përsëri kartën time të gjetur në aplikacionin e telefonit tim?,card_linking
"Karta ime mbërriti, por duhet ta bëj të funksionojë në aplikacion, si ta bëj këtë?",card_linking
Gjeta kartën që mendova se e humba dhe do të doja ta riaktivizoja.,card_linking
E gjeta përsëri kartën time. A mund ta vendos përsëri në aplikacion?,card_linking
Kam nevojë për ndihmë për të lidhur kartën time të re.,card_linking
më ndihmo të lidh kartën time,card_linking
Si ta lidh kartën time në aplikacion.,card_linking
Si mund ta fut kartën time në aplikacion?,card_linking
E gjeta kartën time! A mund ta lidh përsëri në aplikacion?,card_linking
Si mund ta riaktivizoj kartën time?,card_linking
Ku të shkoj për të lidhur kartën time të re?,card_linking
"Mendova se e humba kartën, por e gjeta sot, ndaj do të doja ta riaktivizoja.",card_linking
Si mund ta lidh kartën e re që sapo mora nga ju djema?,card_linking
Si mund të shtoj një kartë të re?,card_linking
Mund të më thoni se si ta marr kartën time në aplikacion?,card_linking
"A është e mundur të riaktivizosh kartën që mendova se e humba, por e gjeta këtë mëngjes në xhaketën time?",card_linking
Si mund ta bëj kartën time të shfaqet në aplikacion?,card_linking
Si ta lidh kartën e re?,card_linking
Ku në aplikacion mund të lidh një kartë të re?,card_linking
Si ta shtoj kartën time në aplikacion pasi ta marr?,card_linking
A mund ta lidh kartën tuaj fizike,card_linking
Si ta aktivizoj dhe lidh kartën time të re?,card_linking
"Kam marrë një kartë, si mund ta marr atë në aplikacion?",card_linking
Mora kartën time të re. Ku është në aplikacion?,card_linking
"E gjeta kartën time, si mund ta përdor përsëri?",card_linking
"Sapo mora një kartë të re, ku të shkoj për ta lidhur me llogarinë time?",card_linking
"kartën e gjetur, si ta rikthejmë në aplikacion",card_linking
Si mund ta shoh kartën time në aplikacion?,card_linking
"Karta që mendova se humba ishte në xhepin e xhaketës time këtë mëngjes, kështu që a mund ta riaktivizoj atë?",card_linking
Nuk e shoh kartën time askund në aplikacion.,card_linking
"Mora kartën time, si mund ta bëj të funksionojë në aplikacion?",card_linking
Çfarë duhet të bëj nëse kam pasur tashmë një kartë me ju djema?,card_linking
"nëse gjeta një kartë të humbur, a mund ta vendos përsëri në aplikacion",card_linking
"Unë kam një kartë që është çaktivizuar, a mund ta riaktivizoj?",card_linking
"Karta ime e re nuk është në aplikacionin tim, si mund ta marr atje?",card_linking
Më ndihmo të aksesoj kartën që kam marrë tashmë në mënyrë që të mund të marr informacione prej saj.,card_linking
Sa vlejnë paratë e mia në vendet e tjera?,exchange_rate
A do të jenë paratë e mia me vlerë të barabartë kur të udhëtoj jashtë vendit?,exchange_rate
A e dini kursin e këmbimit?,exchange_rate
Çfarë kursi valutor do të marr gjatë ditëve të javës dhe në fundjavë?,exchange_rate
Si duket shkëmbimi?,exchange_rate
Si po shkon kursi i këmbimit?,exchange_rate
Do të doja të dija se si llogariten kurset e këmbimit gjatë transferimit të fondeve.,exchange_rate
Do të doja të dija se çfarë kursesh këmbimi përdorni?,exchange_rate
"Nëse më duhet të arkëtoj transferta të huaja, si funksionon kjo?",exchange_rate
A e dini se cilat janë kurset tuaja të këmbimit?,exchange_rate
Si mund ta di se çfarë kursi këmbimi do të marr?,exchange_rate
Cilat janë kurset e këmbimit?,exchange_rate
A keni kursin më të mirë të këmbimit?,exchange_rate
Ku mund t'i gjej kurset tuaja të këmbimit?,exchange_rate
Nga vijnë kurset tuaja të këmbimit?,exchange_rate
Më duhet të di cilat janë kurset tuaja të këmbimit.,exchange_rate
Cili është procesi i shkëmbimeve?,exchange_rate
Çfarë mendoni për kursin e këmbimit?,exchange_rate
Si llogariten kurset e këmbimit në këtë bankë?,exchange_rate
Çfarë përdorni për të përcaktuar kursin e këmbimit për kartën?,exchange_rate
Sa është kursi i këmbimit valutor që do të marr?,exchange_rate
Më duhet të di se çfarë kursi valutor mund të marr.,exchange_rate
Cilat janë kurset aktuale të këmbimit?,exchange_rate
Çfarë kursi këmbimi do të marr?,exchange_rate
Cila është baza e kursit tuaj të këmbimit?,exchange_rate
Si është kursi i këmbimit?,exchange_rate
Si i përcaktoni kursin tuaj të këmbimit?,exchange_rate
Si funksionojnë kurset e këmbimit valutor?,exchange_rate
Nga i merrni kurset e këmbimit?,exchange_rate
Si llogaritet kursi i këmbimit?,exchange_rate
Më intereson se në çfarë bazohen kurset tuaja të këmbimit.,exchange_rate
Si vendosni se cilat janë kurset e këmbimit?,exchange_rate
Cili është kursi aktual i këmbimit?,exchange_rate
Cila është formula për kursin tuaj të këmbimit?,exchange_rate
Çfarë metode përdorni për kursin e këmbimit?,exchange_rate
Cilat janë kurset aktuale të këmbimit ndërbankar?,exchange_rate
nga vijnë kurset tuaja të këmbimit?,exchange_rate
Si i llogaritni kurset e këmbimit?,exchange_rate
Pse kursi juaj i këmbimit është i ndryshëm në ditë të ndryshme?,exchange_rate
Ku mund ta gjej kursin e këmbimit për transferimin tim?,exchange_rate
Nga mund t'i marr kurset tuaja të këmbimit?,exchange_rate
Si e gjeni kursin e këmbimit?,exchange_rate
Si përcaktohen kurset e këmbimit?,exchange_rate
Çfarë vlere mund të marr për monedhën time?,exchange_rate
Ju lutemi shpjegoni politikën tuaj të kursit të këmbimit.,exchange_rate
Nga cilat janë llogaritur kurset tuaja të këmbimit?,exchange_rate
Çfarë është një kurs këmbimi?,exchange_rate
Cili është mendimi juaj për kursin e këmbimit?,exchange_rate
Cilat janë kurset e këmbimit që ju caktoni?,exchange_rate
Si i përcaktoni kurset e këmbimit?,exchange_rate
Si llogariten kurset tuaja të këmbimit?,exchange_rate
Si llogaritet një kurs këmbimi?,exchange_rate
"Kur ndërrojmë, sa janë tarifat?",exchange_rate
Cili është kursi i këmbimit për euron?,exchange_rate
Si mund t'i gjej kurset tuaja të këmbimit?,exchange_rate
Ju lutem mund të më tregoni kursin tuaj të këmbimit?,exchange_rate
