text,category
Nuk isha në dijeni të tarifës shtesë që ishte shtuar në pagesën time të mëparshme. Një njoftim për tarifa shtesë do të vlerësohej në të ardhmen.,card_payment_fee_charged
Nuk mendoj se duhej të më kishin ngarkuar një tarifë për të përdorur kartën time.,card_payment_fee_charged
Një tarifë që nuk duhet të jetë atje është pas përdorimit të kartës sime!,card_payment_fee_charged
"Si mund të shoh se çfarë tarifash duhet të ngarkohem në llogarinë time? Kam vënë re tarifa për disa transaksione, por jo për të tjera. Kjo është shumë konfuze dhe nuk mund të gjej një model për atë që jam duke u akuzuar?",card_payment_fee_charged
Pse tarifohem më shumë për përdorimin e kartës sime?,card_payment_fee_charged
Unë shoh një tarifë që mendoj se është ngarkuar sepse e kam paguar me kartë.,card_payment_fee_charged
Cilat janë tarifat e vendosura kur bëj një transaksion?,card_payment_fee_charged
Sa ishte tarifa shtesë për përdorimin e kartës sime?,card_payment_fee_charged
Pse u shtua një tarifë në faturën time kur përdora kartën time?,card_payment_fee_charged
Ju lutem më tregoni pse u ngarkova me një tarifë për përdorimin e kartës?,card_payment_fee_charged
Si mund të kontrolloj se sa shpenzime falas më kanë mbetur? Kam disa blerje të mëdha që vijnë dhe dua të di se ku mund të kërkoj ndonjë informacion.,card_payment_fee_charged
Më ngarkuan një tarifë kur blija sende me kartën time.,card_payment_fee_charged
Unë u tarifova një shumë shtesë parash për të bërë një blerje me kartën time,card_payment_fee_charged
Sa është tarifa për përdorimin e kartës sime?,card_payment_fee_charged
Sapo pashë një tarifë në llogarinë time. Kur tarifohen këto?,card_payment_fee_charged
A është normale të tarifohem shtesë kur përdor kartën time?,card_payment_fee_charged
Kjo tarifë nuk duhet të jetë aty pasi kam paguar me kartë.,card_payment_fee_charged
Pse më ngarkohet një tarifë shtesë në kartën time?,card_payment_fee_charged
Pse u tarifova më shumë për përdorimin e kartës?,card_payment_fee_charged
Kohët e fundit kam blerë një artikull duke përdorur kartën time dhe jam ngarkuar me një tarifë shtesë pse është kjo?,card_payment_fee_charged
Unë jam i zemëruar që jam tarifuar për përdorimin e kartës sime.,card_payment_fee_charged
Doja të dija pse mora një tarifë shtesë kur përdor kartën time.,card_payment_fee_charged
"A ka një tarifë për të bërë një pagesë? Nëse po, më tregoni pse.",card_payment_fee_charged
Ju lutem më tregoni pse duhet të paguaj një tarifë për një pagesë të fundit. Faleminderit.,card_payment_fee_charged
Pse m'u ngarkua një tarifë për pagesën me kartë debiti ose krediti?,card_payment_fee_charged
Pse u shtua një tarifë shtesë kur përdora kartën time?,card_payment_fee_charged
Pse jam ngarkuar me një tarifë të vogël për të përdorur kartën time?,card_payment_fee_charged
Më ngarkuan një tarifë shtesë për një pagesë me kartë. Unë nuk isha në dijeni më parë për këto tarifa.,card_payment_fee_charged
Pse ka një tarifë të lidhur me përdorimin e kartës?,card_payment_fee_charged
Për çfarë shfaqet kjo tarifë në llogarinë time?,card_payment_fee_charged
Unë u ngarkova me një tarifë për të paguar me kartën time.,card_payment_fee_charged
Pse jam duke u ngarkuar me një tarifë për një pagesë me kartë?,card_payment_fee_charged
A ka ndonjë mënyrë për të shmangur tarifat,card_payment_fee_charged
Vura re një tarifë shtesë kur pagova me kartën time.,card_payment_fee_charged
"Ju nuk reklamoni asnjë tarifë kur paguani me kartë, atëherë deklarata ime tregon një tarifë.",card_payment_fee_charged
"Kishte një tarifë shtesë kur pagova me kartën time, pse u ngarkova me këtë tarifë shtesë?",card_payment_fee_charged
Pse kishte një tarifë shtesë për pagesën që sapo bëra? Zakonisht nuk kam tarifa shtesë për pagesat e mia.,card_payment_fee_charged
çfarë është kjo tarifë shtesë me blerjen time?,card_payment_fee_charged
Përshëndetje! Më ngarkuan rastësisht një tarifë shtesë sot pasi po bëja blerje në internet dhe nuk e di pse! A ka tarifa shtesë për pagesat me kartë? Apo po më mungon diçka këtu?,card_payment_fee_charged
Ju lutemi shpjegoni tarifën shtesë kur pagova me kartë.,card_payment_fee_charged
Kur ngarkoni tarifa në llogari? Sapo pashë një akuzë në deklaratën time.,card_payment_fee_charged
"Pasi përdora kartën time, pashë se u ngarkova një tarifë për përdorimin e saj",card_payment_fee_charged
A ka një leje për kartat?,card_payment_fee_charged
Pse jam duke u ngarkuar me një tarifë të fshehur?,card_payment_fee_charged
Mund të shpjegoni pse u tarifova shtesë kur përdora kartën?,card_payment_fee_charged
Pse më është ngarkuar një tarifë në kartën time?,card_payment_fee_charged
Keni tarifa tani kur paguani me kartë?,card_payment_fee_charged
Cila është tarifa shtesë që u shtua kur përdora kartën?,transfer_not_received_by_recipient
Pse më ngarkohet një tarifë për përdorimin e kartës sime në disa blerje?,transfer_not_received_by_recipient
"Pse jam duke u ngarkuar me një tarifë për përdorimin e kartës time? Nëse ka ndonjë printim nga vendet që më ngarkojnë, a mund të ma dërgoni atë?",transfer_not_received_by_recipient
Si mund të them nëse do të ketë një tarifë të shtuar në pagesën time apo jo?,transfer_not_received_by_recipient
"Nuk premtove asnjë tarifë, por tani unë kam një. Cfare dreqin!?",transfer_not_received_by_recipient
Si mund ta di se cilat pagesa do të kenë tarifa shtesë? Ku mund ta gjej këtë informacion në internet?,transfer_not_received_by_recipient
Unë jam i shqetësuar se ka kaluar shumë kohë për të përfunduar një transferim.,transfer_not_received_by_recipient
"Cili është afati kohor që zakonisht duhet për të realizuar një transferim? Unë kam një mik që ka nevojë për të menjëherë, por ende nuk është arritur.",transfer_not_received_by_recipient
Transaksioni im i parave nuk mund të shihet nga personi të cilit i kam dërguar,transfer_not_received_by_recipient
"Sa kohë duhet zakonisht për të kryer një transferim? I dërgova disa para një shoqeje më herët sot, dhe asaj i duhen vërtet. Është ende një transferim në pritje, edhe pse e dërgova disa orë më parë.",transfer_not_received_by_recipient
"Kam bërë një transferim brenda vendit pardje, por ende nuk është bërë. Ju lutemi mund të kontrolloni se çfarë po ndodh me këtë, numri i llogarisë është padyshim i duhuri, unë e kam kontrolluar tashmë.",transfer_not_received_by_recipient
"Kam bërë një transferim brenda vendit pardje, por ende nuk është bërë. Ju lutem mund të kontrolloni se çfarë po ndodh me këtë, numri i llogarisë është i duhuri, unë e kam kontrolluar këtë disa herë tashmë.",transfer_not_received_by_recipient
Transaksioni im i parave nuk ka ardhur.,transfer_not_received_by_recipient
I dërgova para një personi dhe nuk e kanë marrë ende pagesën.,transfer_not_received_by_recipient
Nuk e di se ku është transaksioni.,transfer_not_received_by_recipient
Kam transferuar para por marrësi nuk i sheh fondet në llogarinë e tij?,transfer_not_received_by_recipient
pse nuk është pastruar ende një transaksion me një mik?,transfer_not_received_by_recipient
Aplikacioni nuk po shfaq transaksionet e mia,transfer_not_received_by_recipient
Pse marrësi nuk e sheh transaksionin? Sapo i dërgova paratë.,transfer_not_received_by_recipient
Kam transferuar para dhe nuk mbërrin aty.,transfer_not_received_by_recipient
A ka ndonjë arsye pse një marrës mund të mos e shohë transaksionin tim të parave,transfer_not_received_by_recipient
Nuk e shoh transaksionin që kam bërë me një mik në llogarinë time.,transfer_not_received_by_recipient
pse është vonuar një transaksion me një mik?,transfer_not_received_by_recipient
"Një transaksion që i bëra mikut tim nuk ka mbërritur ende, pse?",transfer_not_received_by_recipient
Ku është transaksioni im i fundit me para,transfer_not_received_by_recipient
Kam një problem me një transferim brenda vendit që bëra disa ditë më parë. Nuk është shfaqur ende në llogarinë time. Kam kontrolluar për t'u siguruar që të gjitha informacionet e llogarisë janë të sakta disa herë. Çfarë po zgjat kaq shumë transferimi?,transfer_not_received_by_recipient
Kam bërë një transferim pardje brenda këtij vendi. Ende nuk po shfaqet fare. Kam kontrolluar dy herë dhe numri i llogarisë është sigurisht i drejtë. Unë në fakt e kam shkruar këtë disa herë. mund të shikoni se çfarë po ndodh këtu?,transfer_not_received_by_recipient
Sa kohë marrin zakonisht transfertat? I dërgova para një shoku që ka nevojë urgjente. Kanë kaluar orë dhe nuk kanë kaluar.,transfer_not_received_by_recipient
Një transaksion me një mik ende nuk është shfaqur.,transfer_not_received_by_recipient
Unë dërgova para dhe marrësi nuk i ka marrë paratë e tyre pas dy javësh.,transfer_not_received_by_recipient
Sa kohë do të duhet që transferimi im të arrijë?,transfer_not_received_by_recipient
Pse fondet nuk u transferuan te një marrës tjetër?,transfer_not_received_by_recipient
"Dërgova një pagesë, por ajo nuk shfaqet në aplikacion",transfer_not_received_by_recipient
Unë u përpoqa të transferoja disa para dhe nuk e ka bërë ende - çfarë po ndodh?,transfer_not_received_by_recipient
Kam bërë një transfertë dhe ata nuk kanë marrë paratë që u kam dërguar.,transfer_not_received_by_recipient
"sa kohë duhet për të transferuar para, shitësi im është duke pritur",transfer_not_received_by_recipient
"I dërgova para dikujt por nuk i kanë marrë, çfarë po ndodh?",transfer_not_received_by_recipient
Sa kohë duhet që transfertat të përpunohen? I dërgova fonde një shoqeje dhe ajo thotë se ende nuk ka marrë asgjë.,transfer_not_received_by_recipient
Pse nuk ka ardhur ende transaksioni që i kam bërë mikut tim?,transfer_not_received_by_recipient
Kam dërguar para rreth 5 ditë më parë dhe marrësi nuk i ka marrë ende paratë.,transfer_not_received_by_recipient
Unë jam vetëm duke pritur për përfundimin e transaksionit.,transfer_not_received_by_recipient
Transaksioni im me para në dorë nuk shfaqet në llogarinë time,transfer_not_received_by_recipient
Pse nuk ka ardhur transaksioni im?,transfer_not_received_by_recipient
Kur do të transferoni paratë?,transfer_not_received_by_recipient
"Unë jam zhvendosur në një shtëpi të re dhe kam vendosur një pagesë qiraje për pronarin tim, ajo duhej të ishte në llogarinë e saj disa ditë më parë, por nuk ka ardhur. E dërgova patjetër në vendin e duhur, a mund të konfirmoni se ku janë paratë?",transfer_not_received_by_recipient
Më duhet të kontrolloj statusin pasi shoku im nuk ka para që kam dërguar.,transfer_not_received_by_recipient
Sa kohë zgjasin zakonisht transfertat? A ka ndonjë mënyrë për të përshpejtuar procesin? Shoqja ime ka nevojë për paratë që i dërgova në mënyrë të dëshpëruar.,transfer_not_received_by_recipient
ku është fatura e parave të mia,transfer_not_received_by_recipient
Paratë nuk janë në llogarinë e marrësit.,transfer_not_received_by_recipient
Sa kohë duhet për transferimin e parave? I dërgova disa një shoku dhe nuk ka kaluar ende.,transfer_not_received_by_recipient
Pse nuk ka mbërritur ende transaksioni që i bëra mikut tim?,transfer_not_received_by_recipient
Sa kohë marrin transfertat? I dërgova para një miku që i duhen shpejt. Kanë kaluar orë dhe paratë nuk kanë kaluar.,transfer_not_received_by_recipient
"Sa kohë duhet normalisht që një transferim të përpunohet plotësisht? Unë kam një shoqe që ka nevojë menjëherë, por tashmë kanë kaluar 2 orë dhe ajo nuk e ka marrë.",transfer_not_received_by_recipient
Shoku im thotë se nuk e ka marrë transaksionin tim,transfer_not_received_by_recipient
Sa është kohëzgjatja e përfundimit të një transaksioni?,transfer_not_received_by_recipient
Kam transferuar ca para dhe nuk ka ardhur ende.,transfer_not_received_by_recipient
Më duhet t'i transferoj disa para një shoku që ka nevojë urgjente për ca para të shpejta. Sa kohë do të duhet para se ajo të mund t'i përdorë ato para?,transfer_not_received_by_recipient
Dy ditë më parë bëra një transferim në një llogari tjetër brenda vendit. Nuk duket se transferimi u krye. E kam verifikuar disa herë numrin e llogarisë. Ju lutem mund të kontrolloni këtë për mua?,transfer_not_received_by_recipient
Ku shkoi transferta e parave?,transfer_not_received_by_recipient
Kur do të bëhet transaksioni?,transfer_not_received_by_recipient
Para 2 ditësh i kam transferuar disa para nënës sime dhe ajo nuk i ka marrë. E kontrollova dy herë informacionin dhe duket e drejtë. A mund te me ndihmosh?,transfer_not_received_by_recipient
Pse po merr kaq shumë kohë që të përfundojë një transferim!,transfer_not_received_by_recipient
Pse po merr kaq shumë kohë për të përfunduar transferimi im?,transfer_not_received_by_recipient
Unë jam vetëm duke pritur që transaksioni të përfundojë.,transfer_not_received_by_recipient
Sa kohë duhet të pres që transaksioni im të përfundojë?,transfer_not_received_by_recipient
Bëra një transaksion parash dhe marrësi nuk e sheh atë,transfer_not_received_by_recipient
Pse shoku im nuk i ka marrë ende paratë që i kam dërguar?,transfer_not_received_by_recipient
"I dërgova para për qiranë pronarit tim, por ajo pretendon se nuk ka mbërritur në llogarinë e saj A mund ta gjurmoni transferimin që bëra për t'u siguruar që mbërriti në mënyrë që të mund të siguroj prova që e kam dërguar dhe se është depozituar?",transfer_not_received_by_recipient
Pse nuk ka mbërritur ende transaksioni i mikut tim?,transfer_not_received_by_recipient
Ende në pritje të përfundimit të transferimit.,transfer_not_received_by_recipient
"Kam transferuar disa para, por nuk është ende këtu",transfer_not_received_by_recipient
"Çfarë duhet të bëj nëse kam përfunduar një transfertë parash, por marrësi nuk e ka marrë atë?",transfer_not_received_by_recipient
"Para disa ditësh kam bërë një transferim brenda vendit, por ende nuk është arritur. Ju lutem mund të kontrolloni se çfarë po ndodh me këtë, numri i llogarisë është padyshim i duhuri, unë e kam kontrolluar këtë disa herë tashmë.",transfer_not_received_by_recipient
Unë jam ende duke pritur për transaksionin tim.,transfer_not_received_by_recipient
Pse nuk ka ardhur ende një transaksion që i kam bërë mikut tim?,transfer_not_received_by_recipient
"Vendosa një pagesë për një përfitues të ri dhe dërgova disa para, por personi të cilit po ia dërgoj nuk i ka marrë ato. Mund të kontrolloni se ku janë paratë?",transfer_not_received_by_recipient
Pronari im i ri thotë se nuk e ka marrë pagesën e qirasë që kam transferuar disa ditë më parë. Tashmë i kam kontrolluar numrat e llogarisë dhe janë të saktë. A mund të më thoni se çfarë po ndodh me këtë transaksion që transferimi nuk po shfaqet në fund të qiradhënësit tim?,transfer_not_received_by_recipient
Nuk mund ta shoh nëse transferimi që bëra disa ditë më parë është ende në llogarinë time. Kontrollova dy herë informacionin tim përpara se të dërgoja gjithashtu. Mund ta kontrolloni këtë?,transfer_not_received_by_recipient
Transferimi im nuk ka ardhur.,transfer_not_received_by_recipient
Sa kohë duhet për të kryer transferimin?,transfer_not_received_by_recipient
Çfarë ndodh kur transaksioni i parave nuk shfaqet në anën marrëse?,transfer_not_received_by_recipient
"Po përpiqem t'i bëj një pagesë pronarit tim të ri. Edhe pse pagesa është dërguar pak ditë më parë, ajo nuk po zhdoganohet nga ana e tyre. A mund të verifikoni që pagesa është bërë?",transfer_not_received_by_recipient
"Kam pritur 2 ditë që një transfertë të arrijë në një llogari të shitësit, a do të më duhet të pres më gjatë.",transfer_not_received_by_recipient
shoku im nuk i ka marrë paratë që dërgova javën e kaluar.,transfer_not_received_by_recipient
Pse personi që kam dërguar transfertën e parave nuk mund ta shohë atë?,transfer_not_received_by_recipient
Paratë ende nuk janë vendosur në llogarinë e marrësit.,transfer_not_received_by_recipient
Këtu po shqetësohem. I dërgova një shoqe disa para dhe ajo nuk po i sheh. Çfarë po ndodh?,transfer_not_received_by_recipient
Kam përfunduar transferimin pardje në këtë vend. Transferimi ende nuk ka përfunduar. Unë e kam kontrolluar numrin e llogarisë disa herë për t'u siguruar që është i duhuri. Mund të kontrolloni për të parë se çfarë po ndodh me këtë?,transfer_not_received_by_recipient
"Kam bërë një transfertë për pagesën e qirasë rreth 2 ditë më parë, por pronari im nuk e ka marrë ende. Ajo tregon si është bërë në anën time, dhe unë i kam kontrolluar dy herë të gjithë numrat e llogarisë dhe ata janë të saktë. A mund të verifikoni që transaksioni është kryer në të vërtetë?",transfer_not_received_by_recipient
Pse nuk ka mbërritur ende një transaksion që i kam bërë mikut tim?,transfer_not_received_by_recipient
Unë jam duke pritur që transaksioni im të përfundojë.,transfer_not_received_by_recipient
Pse shoku im nuk e ka marrë transaksionin?,transfer_not_received_by_recipient
Kam transferuar para dhe nuk ka ardhur ende,transfer_not_received_by_recipient
Pse djali im nuk e ka marrë transfertën që i kam dërguar më herët?,transfer_not_received_by_recipient
"Sa kohë zgjasin transfertat e parave? Shokut tim i duhen vërtet paratë që i dërgova disa orë më parë, por nuk janë ende aty.",transfer_not_received_by_recipient
Pse nuk ka ardhur ende transferta e parave?,transfer_not_received_by_recipient
Unë nuk e kam marrë transaksionin e përfunduar.,transfer_not_received_by_recipient
sa kohë duhet për të arritur një transfertë,transfer_not_received_by_recipient
Si ka mundësi që paratë e mia nuk janë shfaqur ende?,transfer_not_received_by_recipient
"Përshëndetje, para disa ditësh ia kam transferuar qiranë pronarit tim, por ai thotë se nuk ka shkuar. Nga ana ime, gjithçka duket mirë dhe kontrollova dy herë numrin e llogarisë. A ka ndonjë gjë tjetër që mund të pengojë kontrollin?",transfer_not_received_by_recipient
Pse marrësi i transaksionit tim të parave nuk mund ta shohë atë?,transfer_not_received_by_recipient
Marrësi nuk e sheh transaksionin e parave që kam bërë,transfer_not_received_by_recipient
Sa kohë do të marrë transaksioni im?,transfer_not_received_by_recipient
Sa kohë duhet të kalojë një transferim? Unë kam qenë duke pritur një kohë.,transfer_not_received_by_recipient
"Kam futur aksidentalisht informacionin e shitësve të mi, çfarë duhet të bëj më pas",transfer_not_received_by_recipient
Transferova ca para dhe nuk mbërrin,transfer_not_received_by_recipient
ku kanë shkuar paratë e mia të transferuara?,transfer_not_received_by_recipient
"Unë u përpoqa të bëja një transferim brenda vendit në fillim të kësaj jave. Mendova se do të ishte atje deri tani, por ende nuk i shoh paratë. Mund të kontrolloni statusin e transferimit tim?",transfer_not_received_by_recipient
"A ka ndonjë arsye që një pagesë po shfaqet e plotë nga ana ime, por personi që e merr atë nuk e ka marrë?",transfer_not_received_by_recipient
"Kam kontrolluar disa herë për t'u siguruar që numri i llogarisë i listuar është i duhuri pasi u përpoqa të bëja një transferim brenda vendit pardje. Transferimi nuk është ende i disponueshëm, kështu që a mund të mësoni se çfarë po ndodh?",transfer_not_received_by_recipient
"Kam transferuar disa para, por nuk kanë ardhur.",transfer_not_received_by_recipient
Pse transaksioni im po merr kaq shumë kohë për të përfunduar?,transfer_not_received_by_recipient
Transferimi im nuk është bërë,transfer_not_received_by_recipient
"I dërgova para familjes sime të premten e kaluar, por ata nuk i kanë.",transfer_not_received_by_recipient
Kur do t'i marr paratë e mia? Ka kaluar shumë kohë.,transfer_not_received_by_recipient
Pse transferta ime nuk arriti te marrësi?,transfer_not_received_by_recipient
Nuk kam marrë para nga një transferim?,transfer_not_received_by_recipient
"Kam transferuar një pagesë para disa ditësh dhe më duket e kryer, por nuk është marrë. Ju lutem mund të më ndihmoni?",transfer_not_received_by_recipient
I pagova qiranë pronarit tim disa ditë më parë dhe ai po thotë se nuk shkoi kurrë. Gjithçka më duket mirë dhe madje kontrollova dy herë numrin e llogarisë. Nuk e di se çfarë mund të shkaktojë konfuzionin. A mund të më ndihmoni ju lutem?,transfer_not_received_by_recipient
Transaksioni im nuk është marrë. Kur do ta përpunoni?,transfer_not_received_by_recipient
"Përshëndetje, i dërgova pronarit tim paratë e qirasë para disa ditësh dhe ndërsa gjithçka më duket mirë në fund, ai thotë se nuk i ka marrë kurrë paratë. Kontrollova dy herë numrin e llogarisë dhe është i saktë. Mund të më ndihmoni ta kuptoj këtë?",transfer_not_received_by_recipient
Transaksioni im me para në dorë nuk shfaqet në faturën time,transfer_not_received_by_recipient
Transferimi im nuk ka ardhur,transfer_not_received_by_recipient
Kam bërë një transaksion parash dhe nuk kam një faturë,transfer_not_received_by_recipient
"Unë kam një mik që ka nevojë për para sa më shpejt të jetë e mundur. Nëse do ta transferoja, sa kohë do të duhet për të arritur tek ajo?",transfer_not_received_by_recipient
Pse nuk ka ardhur ende transaksioni i mikut tim?,transfer_not_received_by_recipient
"Përshëndetje - Unë kam bërë një transaksion me qiradhënësin tim të ri, por për fat të keq ai shfaqet në fundin tim, por jo në fundin e qiradhënësit. Numrat janë të saktë. A mund të konfirmoni se kur do të ndodhë?",transfer_not_received_by_recipient
I dërgova para dikujt por nuk i kanë marrë ende,transfer_not_received_by_recipient
Sa kohë do të duhet për të marrë paratë e mia nga transaksioni im i transferimit?,transfer_not_received_by_recipient
Transferimi im nuk arriti te marrësi,transfer_not_received_by_recipient
Marrësi nuk i ka marrë paratë,transfer_not_received_by_recipient
Marrësi nuk mund të gjejë fondet.,transfer_not_received_by_recipient
Pse transferimi im nuk ka ardhur ende?,transfer_not_received_by_recipient
"Pronari im i ri është një gënjeshtar dhe po përpiqet të më rrëmbejë duke thënë se nuk e kam paguar qiranë kur kam paguar qiranë. Cfare po ndodh? Ata thonë se paratë nuk u kanë shkuar, por unë e shoh që po më dalin nga llogaria. Mund të kontrolloni nëse paratë shkuan në vendin e duhur?",transfer_not_received_by_recipient
I kam bërë një transfertë shoqes sime më parë dhe ajo nuk e ka marrë ende. Çfarë është pengesë?,transfer_not_received_by_recipient
"|U largova nga shtëpia ime e vjetër dy javë më parë dhe anulova debitimin tim të drejtpërdrejtë te qiradhënësi im i vjetër, ky debitim direkt funksiononte mirë. Tani jam zhvendosur në një vend të ri dhe kam vendosur një transferim te një pronar i ri, por ajo nuk është arritur ende, a mund ta kontrolloni ju lutem?",transfer_not_received_by_recipient
Pse është ende në pritje transaksioni me mikun tim?,transfer_not_received_by_recipient
"Pardje kam kryer një transferim brenda vendit. Ende nuk ka përfunduar. Mund ta kontrolloni këtë? Numri i llogarisë është padyshim i saktë, siç e kam kontrolluar.",transfer_not_received_by_recipient
"I kam kontrolluar disa herë informacionet e llogarisë për t'u siguruar që janë të sakta, por transferimi në vend që bëra disa ditë më parë ende nuk është shfaqur! Çfarë është mbajtja lart?",transfer_not_received_by_recipient
"Kam kryer pardje një transferim brenda vendit, por nuk ka kaluar? Mund ta kontrolloni këtë? Numri i llogarisë është padyshim i saktë, siç e kam kontrolluar.",transfer_not_received_by_recipient
Pardje kam transferuar fonde në një llogari tjetër brenda vendit. Fondet nuk kanë ardhur ende. Kam kontrolluar dyfish dhe trefish numrin e llogarisë dhe ishte i saktë. Pse transferimi nuk ka përfunduar ende?,transfer_not_received_by_recipient
Pse personi që kam dërguar para nuk e shikon ende atë transfertë?,transfer_not_received_by_recipient
Sa kohë duhet që transfertat të miratohen? I dërgova fonde të dashurës sime dhe ajo thotë se nuk ka parë asnjë fond të miratuar në llogarinë e saj.,transfer_not_received_by_recipient
Sa kohë do të kalojë para se personi të cilit i kam dërguar para të jetë në gjendje t'i shohë ato?,transfer_not_received_by_recipient
Unë jam ende në pritje për përfundimin e transaksionit.,transfer_not_received_by_recipient
Sa është koha për një transferim?,transfer_not_received_by_recipient
Unë nuk e shoh faturën time,transfer_not_received_by_recipient
Pse transaksioni im nuk është përfunduar?,transfer_not_received_by_recipient
Dërgova disa para dhe llogaria nuk e ka marrë transfertën që kam bërë.,transfer_not_received_by_recipient
Unë jam ende duke pritur që transaksioni të përfundojë,transfer_not_received_by_recipient
I transferova disa para një miku im që ka nevojë urgjente për disa para tani. Sa kohë do të duhet për të arritur tek ajo?,transfer_not_received_by_recipient
"Unë dërgova një pagesë, por personi që ia dërgova thotë se nuk e kanë",transfer_not_received_by_recipient
