text,category
"Kur shkova në ATM për të marrë ca para sot, tërheqja ime u refuzua. Më duhet ta rregulloj këtë problem sa më shpejt të jetë e mundur. cfare po ndodh",declined_cash_withdrawal
Nuk mund të marr para nga llogaria ime.,declined_cash_withdrawal
"U përpoqa të tërhiqja para, por nuk pranova!",declined_cash_withdrawal
"ATM-ja nuk më lejon të marr para, PSE?",declined_cash_withdrawal
Nuk mund të tërheq para nga llogaria ime. Kam provuar disa makina të ndryshme ATM dhe të dyja nuk më jepnin paratë e mia. Çfarë po ndodh? A është bllokuar llogaria ime apo diçka tjetër?,declined_cash_withdrawal
Pse u refuzua tërheqja ime nga bankomati,declined_cash_withdrawal
pse do të më refuzonin nëse do të kisha para në llogarinë time,declined_cash_withdrawal
Pse u anulua tërheqja e parave të gatshme në ATM?,declined_cash_withdrawal
Pse nuk mund të tërheq para?,declined_cash_withdrawal
Pse nuk jam në gjendje të tërheq para?,declined_cash_withdrawal
"Sapo më refuzuan kartën në ATM! Më duhet të nxjerr para, por nuk mundem. Pse ka ndodhur kjo?",declined_cash_withdrawal
"Kam futur kodin e duhur, por ende nuk mund të marr fonde.",declined_cash_withdrawal
Karta ime nuk do të funksionojë në një ATM,declined_cash_withdrawal
"Pse ATM-ja e refuzon vazhdimisht kartën time? Kam provuar disa herë në makina të ndryshme me të njëjtat rezultate. Mendova se kisha fonde të mjaftueshme për këtë, kështu që ju lutem më ndihmoni të kuptoj pse po ndodh kjo.",declined_cash_withdrawal
e futa gabimisht pinin tim dhe e ngriva. sa përpjekje kam,declined_cash_withdrawal
Kjo është hera e parë që përpiqem të nxjerr paratë e mia nga një bankomat dhe nuk funksionoi. Ju lutem më jepni paratë e mia,declined_cash_withdrawal
Pse kam probleme me tërheqjen e parave?,declined_cash_withdrawal
"U përpoqa të bëja një tërheqje nga ATM, por u anulua.",declined_cash_withdrawal
Nuk mund të merrja para nga një bankomat,declined_cash_withdrawal
Unë mendoj se kam një problem me tërheqjet në kartën time. U refuzua gjatë rrugës për në punë mëngjesin e sotëm. Kjo nuk ka ndodhur në të kaluarën.,declined_cash_withdrawal
"U përpoqa të merrja para me para në dorë, por më refuzuan!",declined_cash_withdrawal
Tërheqja ime nga ATM u anulua,declined_cash_withdrawal
Mund të më duhet një kartë e re sepse nuk funksionon në asnjë nga ATM-të. Nuk mendoj se i kam përdorur të gjitha paratë e mia. Pse po e bën këtë?,declined_cash_withdrawal
"Ju lutemi kontrolloni kartën time. Duke qenë se Tërheqja ishte duke punuar mirë deri më tani, por këtë mëngjes papritmas u refuzua. Ju lutem mund ta kontrolloni problemin?",declined_cash_withdrawal
"U përpoqa të tërhiqja disa fonde nga karta ime, por më refuzuan. Si mund t'i marr paratë e mia?",declined_cash_withdrawal
Nuk mund të marr bankomatin për të më dhënë para,declined_cash_withdrawal
Nuk mund të marr para nga ATM,declined_cash_withdrawal
Si është e mundur që ATM nuk më jep paratë e mia?,pending_card_payment
"U përpoqa të tërhiqja para nga ATM-ja juaj, por transaksioni im u anulua.",pending_card_payment
Pse ATM anuloi transaksionin tim,pending_card_payment
Pse ATM-ja nuk më jep para?,pending_card_payment
Pse nuk do të kalonte tërheqja ime?,pending_card_payment
"U përpoqa të merrja para në ATM, por më refuzuan",pending_card_payment
ATM-ja nuk më la të merrja para,pending_card_payment
Pse nuk jam në gjendje të tërheq para edhe pse në të kaluarën e kam bërë mirë?,pending_card_payment
Më refuzuan kur u përpoqa të merrja para!,pending_card_payment
si u refuzova,pending_card_payment
Çfarë do të thotë kur një pagesë është në pritje?,pending_card_payment
"Mund të më thoni, ju lutem, pse blerjet e mia nga ky mëngjes thonë se pagesa është në pritje?",pending_card_payment
Blerja që bëra është ende në pritje.,pending_card_payment
A ka ndonjë problem me pagesën që shoh se është ende në pritje?,pending_card_payment
Ka një pagesë që kam bërë që nuk është kryer ende.,pending_card_payment
Sa kohë duhet në të vërtetë për të kryer një pagesë me kartë? Ka një të mbërthyer prej disa ditësh tashmë që nuk duket se lëviz,pending_card_payment
Pse pagesa ime duket në pritje?,pending_card_payment
Sa kohë zakonisht shfaqet një pagesë në pritje? A është normale që imi është ende pezull?,pending_card_payment
Pse pagesa ime është në pritje?,pending_card_payment
Kam një pagesë me kartë e cila shfaqet në pritje,pending_card_payment
Kam bërë një pagesë me kartën time dhe nuk ka ndryshuar. Sa kohë mendoni se do të zgjasë kjo?,pending_card_payment
Pse pagesa shfaqet si në pritje nga gjërat që bleva këtë mëngjes?,pending_card_payment
Bëra një pagesë me kartë e cila më tregon në pritje.,pending_card_payment
Pse pagesat e mia nuk funksionojnë dhe shfaqen në pritje?,pending_card_payment
"Kam bërë një pagesë pak kohë më parë dhe ende nuk është zhdoganuar dhe shfaqet si 'në pritje', sa kohë duhet për të fshirë?",pending_card_payment
Pse gjërat që bleva më herët sot shfaqen ende në pritje?,pending_card_payment
Pagesa me kartë është ende në pritje.,pending_card_payment
"Pagesa ime me kartë po shfaqet si në pritje që përgjithmonë, çfarë po ndodh me këtë, duhet të kalojë në një moment?",pending_card_payment
Unë kam një pagesë që nuk ka kaluar ende,pending_card_payment
"Fillova një pagesë pak kohë më parë dhe ajo ende shfaqet si 'në pritje', sa kohë do të duhet për të pastruar?",pending_card_payment
Pse blerja ime shfaqet në pritje?,pending_card_payment
Sa kohë do të duhet që pagesa ime të kryhet?,pending_card_payment
"Pasi kam bërë një pagesë me kartën time, duket se nuk ka funksionuar. Thjesht po tregohet se është në pritje. Kur do të ndodhë në të vërtetë kjo?",pending_card_payment
"Ai thotë ""në pritje të pagesës?"" Pse e thotë këtë?",pending_card_payment
A ka ndonjë arsye që pagesat e mia janë në pritje?,pending_card_payment
Pse pagesa me kartë është ende një transaksion në pritje?,pending_card_payment
"Pagesa me kartë është ende në pritje, pse është kështu?",pending_card_payment
Unë kam pritur që pagesa me kartë të zhvendoset nga statusi në pritje për një kohë jashtëzakonisht të gjatë. Çfarë po ndodh këtu dhe a keni një ide se kur mund të pres që të kalojë?,pending_card_payment
Si ndodh që pagesa me kartë është ende në pritje?,pending_card_payment
Kam vënë re se ka një pagesë në pritje në kartën time.,pending_card_payment
Si është ende në pritje pagesa me kartë?,pending_card_payment
Pse pagesa ime me kartë është ende në pritje?,pending_card_payment
Çfarë do të thotë pagesa në pritje?,pending_card_payment
Pse pagesa ime është ende në pritje?,pending_card_payment
Çfarë do të thotë kur thotë se kam një pagesë që është në pritje?,pending_card_payment
"Pagesa me kartë po shfaqet në pritje, megjithatë ky transaksion ishte disa ditë më parë. A ka ndonjë arsye pse është ende në pritje?",pending_card_payment
Një pagesë me kartë në llogarinë time shfaqet si në pritje.,pending_card_payment
Pse një tarifë e tyre është ende në pritje për kartën time?,pending_card_payment
Pagesa me kartë thotë në pritje dhe nuk ka ndryshuar,pending_card_payment
Pagesa me kartë po shfaqet si në pritje,pending_card_payment
Sa është më e gjata që një pagesë do të tregojë në pritje? Ka një që tregon që ka qëndruar atje për disa ditë.,pending_card_payment
"Unë u përpoqa të paguaj përmes llogarisë sime, por pagesa nuk po kalon. Çfarë po ndodh?",pending_card_payment
Pse është ende në pritje pagesa në kartën time?,pending_card_payment
Çfarë kërkon kaq shumë kohë që kjo pagesë të kryhet?,pending_card_payment
Pse nuk e kam marrë ende pagesën time?,pending_card_payment
Duket se një pagesë që kam bërë nuk e ka kryer ende.,pending_card_payment
Pagesa ime me kartë ka pasur statusin e pezullimit përgjithmonë. Cila është çështja? Duhet të kishte kaluar në një moment.,pending_card_payment
Një pagesë është në pritje,pending_card_payment
Pse nuk është pastruar ende pagesa me kartë?,pending_card_payment
"Unë kam bërë një pagesë me kartë disa ditë më parë tani, por duket se paratë kanë ngecur. Sa kohë zakonisht duhet që pagesa të kryhet?",pending_card_payment
Pagesa ime po merr shumë kohë për të kryer.,pending_card_payment
Çfarë do të thotë nëse pagesa ime është në pritje?,pending_card_payment
Kur do të kryhet pagesa ime?,pending_card_payment
Pagesa me kartë është ende në pritje,pending_card_payment
Sa kohë shfaqet një pagesë në pritje përpara se të shqetësohem për të?,pending_card_payment
Pse është në pritje pagesa me kartë?,pending_card_payment
"Bëra një pagesë me kartë me kartën time, por dështoi. Ju lutem më njoftoni se kur do të përfundojë pagesa pasi është ende në pritje.",pending_card_payment
"Përshëndetje, statusi i njërës prej pagesave me kartë është ende në pritje prej një kohe. Ju lutemi tregoni se sa kohë do të duhet për të përfunduar.",pending_card_payment
"Pasi të bëj një pagesë, sa kohë do të kalojë nga ""në pritje"" në përfundim?",pending_card_payment
"Pagesa me kartë po shfaqet si në pritje për një kohë shumë të gjatë, çfarë po ndodh me këtë, duhet të kalojë në një moment?",pending_card_payment
Blerjet e mia nga ky mëngjes po shfaqen si pagesë në pritje. Mund të më thoni pse?,pending_card_payment
Ka një pagesë që nuk është përpunuar.,pending_card_payment
Unë jam ende duke pritur për një pagesë,pending_card_payment
Më duhet të zbuloj pse pagesa ime në pritje nuk ka përfunduar.,pending_card_payment
Pres të përpunohet një pagesë,pending_card_payment
Nuk e kuptoj pse pagesa ime me kartë është në pritje. Ka qenë në pritje për një kohë të gjatë. Pse është kjo dhe kur mund të ndodhë?,pending_card_payment
"Bëra një pagesë me kartën time, por duket se nuk funksionoi, ajo është ende e listuar si në pritje që prej pak kohësh. Kur kalon në të vërtetë kjo?",pending_card_payment
"Më duhet të di se kur do të kryhet një pagesë. Përfundova një pagesë duke përdorur kartën time, por ajo po shfaqet si në pritje në këtë pikë dhe ka qenë pak kohë më parë.",pending_card_payment
Kur do të kryhet transaksioni?,pending_card_payment
Pagesa ime me kartë ka mbetur në pritje. Cili është problemi? Duhet të kishte kaluar deri tani.,pending_card_payment
Pse blerja që bëra këtë mëngjes është ende në pritje?,pending_card_payment
Një transaksion në kartën time shfaqet si në pritje.,pending_card_payment
Unë kam një pagesë në pritje në kartën time. Pse?,pending_card_payment
Unë kam një pagesë me kartë që është në pritje për disa kohë dhe do të doja të di se kur do të kryhet.,pending_card_payment
Bëra një pagesë pak kohë më parë dhe ende shfaqet si 'në pritje' në llogari. Sa kohë do të duhet për të përfunduar këtë pagesë?,pending_card_payment
Çfarë do të thotë një 'pagesë në pritje'?,pending_card_payment
"Përshëndetje, kam bërë një pagesë me kartën time dhe nuk funksionon. Ka kaluar një kohë dhe ende thotë se është në pritje. A mund të thoni kur do të kalojë kjo?",pending_card_payment
"Përshëndetje, Një pagesë është ende në pritje për të cilën unë kam paguar tashmë me kartë. Mendoj se nuk u përpunua, a mund të më kontrolloni dhe përditësoni.",pending_card_payment
Blerja ime nga ky mëngjes është ende në pritje.,pending_card_payment
Pse pagesa ime me kartë është ende e listuar si në pritje?,pending_card_payment
"Një nga pagesat e mia me kartë duket sikur ka ngecur, por e kam bërë pagesën ditë më parë. Sa kohë do të aplikohet pagesa në llogarinë time?",pending_card_payment
Nuk e di se çfarë do të thotë transaksioni në pritje.,pending_card_payment
"Pagesa ime me kartë sapo po shfaqet si në pritje që përgjithmonë, çfarë po ndodh me këtë, kur duhet të kryhet?",pending_card_payment
Ai thotë statusi në pritje për pagesën time. Pse?,pending_card_payment
transaksion në pritje?,pending_card_payment
Vura re se ka një pagesë në kartën time që është në pritje.,pending_card_payment
Kur do të fshihet një pagesë që kam bërë me kartën time>,pending_card_payment
Pagesa ime me kartë ka qenë në pritje për një kohë të gjatë tani. Pse po merr kaq shumë kohë për të marrë. Duhet ta kishte arritur tashmë.,pending_card_payment
Çfarë do të thotë nëse thotë se pagesa ime është në pritje?,pending_card_payment
Pse janë ende në pritje blerjet e mia nga ky mëngjes?,pending_card_payment
"Po pyesja veten pse pagesa ime nuk ka përfunduar ende, ka kaluar një kohë.",pending_card_payment
Pagesa ime me kartë ka qenë në pritje përgjithmonë. Cili është problemi? Duhet të kishte kaluar dikur deri tani.,pending_card_payment
"Bëra një pagesë me kartë, por statusi i saj është ende në pritje. Ju lutemi kontrolloni dhe informoni kur do të përfundojë.",pending_card_payment
"Unë kam bërë një pagesë me kartë, por ajo nuk ka përfunduar duke u shfaqur ende në pritje. Ju lutem më tregoni se kur do të përfundojë.",pending_card_payment
Pse nuk ka kaluar pagesa ime?,pending_card_payment
Pse pagesa ime me kartë është ende në pritje? Duhet të kishte kaluar tashmë.,pending_card_payment
Bëra një blerje këtë mëngjes dhe po shfaqet si në pritje.,pending_card_payment
"Ekziston një pagesë e vetme në kartën time, e cila shfaqet në pritje.",pending_card_payment
"Sa kohë më duhet në të vërtetë pagesa me kartë për ta bërë atë në llogari? Kam bërë një pagesë disa ditë më parë, por nuk ka lëvizur që atëherë.",pending_card_payment
Sa kohë duhet që pagesa ime të përpunohet?,pending_card_payment
Pse pagesa ime për kartën time do të shfaqet në pritje?,pending_card_payment
Pse nuk janë të disponueshme për mua fondet e mia të pagesës?,pending_card_payment
"Mora disa artikuj këtë mëngjes, por pagesa thotë në pritje",pending_card_payment
Pse pagesa që kam bërë është ende pezull?,pending_card_payment
A ka ndonjë problem që bën që pagesat e mia të shfaqen në pritje?,pending_card_payment
"Bëra një blerje më herët sot, por ajo është ende e listuar si në pritje - kur do të përfundojë?",pending_card_payment
Pse nuk e kam procesuar pagesën,pending_card_payment
Kam një pagesë që nuk është kryer ende.,pending_card_payment
"Kam bërë një pagesë, por është ende në pritje",pending_card_payment
Sa kohë duhet që një blerje e re të mos konsiderohet në pritje?,pending_card_payment
Pyesja veten se sa kohë duhet për të kryer një pagesë? Duket se pagesa ime e fundit ka ngecur dhe nuk ka lëvizur.,pending_card_payment
Cili është shkaku i vonesës në aplikimin e pagesës me kartë në llogarinë time?,pending_card_payment
Pse pagesa ime do të shfaqet ende në pritje?,pending_card_payment
Kam një pagesë që nuk është miratuar.,pending_card_payment
Çfarë do të thotë kur thotë se kam një pagesë në pritje?,pending_card_payment
"Ka një pagesë në pritje në llogarinë time, çfarë do të thotë kjo?",pending_card_payment
Pse pagesa me kartë nuk është aplikuar ende në llogarinë time?,pending_card_payment
"Bleva disa gjëra në mëngjes, por pagesa duket në pritje",pending_card_payment
Nuk e di se çfarë është një pagesë në pritje.,pending_card_payment
pse kam një pagesë në pritje?,pending_card_payment
Sa kohë duhet në të vërtetë për të kryer një pagesë me kartë? Ka një të mbërthyer prej disa ditësh që nuk duket se lëviz,pending_card_payment
Unë blej disa artikuj sot. Pse po shfaqen ende në pritje?,pending_card_payment
Ekziston një pagesë që shfaqet në pritje dhe nuk është postuar për disa ditë. Kur do të postohet?,pending_card_payment
Unë kam bërë një pagesë me kartën time dhe është ende në pritje për një kohë të gjatë. Ju lutem mund të më tregoni se kur do të përpunohet.,pending_card_payment
Përfundova një pagesë me kartën time pak kohë më parë. Po shfaqet ende si në pritje. Çfarë afati kohor merr zakonisht kjo? Nuk duket se ka funksionuar.,pending_card_payment
Pagesa në kartën time shfaqet në pritje.,pending_card_payment
Unë kam një pagesë që është ende në pritje,pending_card_payment
Bleva diçka sot në mëngjes dhe pagesa është ende në pritje,pending_card_payment
"Ka një transaksion në pritje në llogarinë time, çfarë do të thotë kjo?",pending_card_payment
Bëra një pagesë që është në pritje. A do të kalojë?,pending_card_payment
"Ka disa ditë që jam përpjekur të paguaj një shitës, por fondet nuk po kalojnë. Çfarë po ndodh?",pending_card_payment
Bëra një pagesë që duket se ka ngecur. Kanë kaluar disa ditë tashmë. Mund të më thoni sa kohë do të zgjasë?,pending_card_payment
Bëra një pagesë që nuk ka përfunduar ende.,pending_card_payment
Pse nuk është shfaqur ende pagesa ime?,pending_card_payment
Cili është kuptimi i një pagese në pritje?,pending_card_payment
"Pagesa ime është në aplikacion, por nuk ka përfunduar ende",pending_card_payment
Sa ditë duhen për të përfunduar një transaksion të rregullt? Unë shoh një pagesë në pritje që nuk ka ndryshuar në ditët e fundit.,pending_card_payment
Pse pagesa ime nuk ka përfunduar ende?,pending_card_payment
Pagesa ime ka mbetur në pritje.,pending_card_payment
A ka ndonjë arsye që pagesa ime është ende në pritje?,pending_card_payment
Sa është kohëzgjatja në pritje për transaksionet e kreditit? Unë e kam një në kategorinë time në pritje për ditë të tëra dhe nuk do të kalojë në përpunim.,pending_card_payment
Sa kohë duhet që një pagesë të ndryshojë nga pezull?,pending_card_payment
Pagesa me kartën time të kreditit ka qenë në gjendje pezull për një kohë super të gjatë. Nuk e kuptoj. Pse është kështu? Kur do të kalojë?,pending_card_payment
Pse pagesa nuk ka përfunduar ende?,pending_card_payment
Pse është në pritje kjo pagesë?,pending_card_payment
Pse pagesa nga karta ime është ende në pritje?,pending_card_payment
Për çfarë është pagesa në pritje në kartën time?,pending_card_payment
"Ai thotë se pagesa ime është në pritje, çfarë do të thotë kjo?",pending_card_payment
Unë u përpoqa të bëja një pagesë me kartën time dhe ajo u refuzua. Pse është në pritje?,pending_card_payment
Pse thotë se kam një pagesë në pritje?,lost_or_stolen_phone
"A ka ndonjë gjë të gabuar me pagesën time me kartë? Ka qenë në pritje për një kohë vërtet, vërtet të gjatë.",lost_or_stolen_phone
Blerjet e mia nga ky mëngjes kanë ende pagesa në pritje.,lost_or_stolen_phone
Kur do të përfundojë pagesa ime në pritje?,lost_or_stolen_phone
"Kam përdorur kartën time për të bërë një pagesë pak kohë më parë dhe është ende në pritje, Pse po zgjat kaq shumë?",lost_or_stolen_phone
Sa kohë duhet që një blerje të kalojë nga pezull në të autorizuar?,lost_or_stolen_phone
"Karta ime ka qenë në pritje për një kohë, çfarë duhet të bëj?",lost_or_stolen_phone
Ka një pagesë që kam bërë që kam vënë re se nuk ka kaluar ende. A mund të pyes pse?,lost_or_stolen_phone
"Pagesa ime me kartë sapo po shfaqet si në pritje dhe ka kaluar një kohë, çfarë po ndodh me këtë, duhet të kalojë në një moment?",lost_or_stolen_phone
Sa kohë do të jetë në pritje pagesa ime?,lost_or_stolen_phone
"Më është vjedhur telefoni, çfarë duhet të bëj së pari?",lost_or_stolen_phone
"Më kanë vjedhur telefonin, çfarë duhet të bëj?",lost_or_stolen_phone
"Kam humbur telefonin tim, çfarë duhet të bëj?",lost_or_stolen_phone
"Dikush më ka vjedhur telefonin, çfarë duhet të bëj?",lost_or_stolen_phone
Unë mendoj se kam humbur telefonin tim. A ka ndonjë mënyrë për të parandaluar që dikush të hyjë në llogarinë time në të?,lost_or_stolen_phone
Më vodhën telefonin! Çfarë duhet të bëj?,lost_or_stolen_phone
A mund ta përdor aplikacionin pa telefonin tim?,lost_or_stolen_phone
"Dje më vodhën çantën, kështu që nuk mund të përdor asnjë aplikacion apo asgjë. Unë kam nevojë për ndihmë.",lost_or_stolen_phone
"Dikush më vodhi telefonin, cili është hapi im i radhës?",lost_or_stolen_phone
"Kam harruar telefonin tim në hotel, kështu që nuk mund të hyj në aplikacion.",lost_or_stolen_phone
"Ndihmë, telefoni im është vjedhur, ju lutemi këshilloni!",lost_or_stolen_phone
telefoni im ka humbur,lost_or_stolen_phone
"Unë kam nevojë për ndihmë- Më kanë grabitur dje dhe ata morën gjithçka, kështu që nuk mund ta përdor aplikacionin.",lost_or_stolen_phone
Unë nuk mund ta gjej telefonin tim dhe jam i shqetësuar se dikush do ta përdorë atë,lost_or_stolen_phone
Kam humbur telefonin tim! A do të funksionojë akoma karta ime?,lost_or_stolen_phone
Nuk mund ta gjej telefonin tim ose më është vjedhur.,lost_or_stolen_phone
"Nuk mund ta përdor aplikacionin, sepse dje u grabita dhe ata morën gjithçka. Ju lutem ndihmë.",lost_or_stolen_phone
A mund të më thoni se çfarë hapash duhet të ndërmarr pasi më është vjedhur karta?,lost_or_stolen_phone
Çfarë duhet të bëj nëse telefoni im është vjedhur?,lost_or_stolen_phone
Çfarë duhet të bëj nëse nuk mund të aksesoj aplikacionin?,lost_or_stolen_phone
Çfarë duhet të bëj nëse telefoni im është vjedhur?,lost_or_stolen_phone
E lashë telefonin diku dhe nuk mund ta përdor aplikacionin.,lost_or_stolen_phone
Dikush më plaçkiti dhe vodhi gjithçka. Nuk mund ta përdor aplikacionin. Cfare duhet te bej?,lost_or_stolen_phone
"Unë u grabita dje dhe ata morën gjithçka. Nuk mund ta përdor aplikacionin, kështu që kam nevojë për ndihmë.",lost_or_stolen_phone
Nuk jam i sigurt se ku është telefoni im.,lost_or_stolen_phone
"Nëse telefoni im është vjedhur, a duhet të bëj ndonjë gjë?",lost_or_stolen_phone
Ju lutem ndihmë! Më grabitën dhe më vodhën gjithçka. Çfarë duhet të bëj për t'i ndaluar ata të hyjnë në llogarinë time?,lost_or_stolen_phone
Kam një urgjencë dhe kam humbur telefonin. Kam nevojë për ndihmë për të hyrë në llogarinë time.,lost_or_stolen_phone
"telefoni i vjedhur, çfarë duhet të bëj",lost_or_stolen_phone
Me ndihmo. Telefoni im është humbur ose vjedhur!,lost_or_stolen_phone
Aplikacioni im ishte në telefon dhe unë u grabita. Çfarë të bëj?,lost_or_stolen_phone
"Nuk e kam pajisjen që përdora për t'u identifikuar në platformë, kështu që nuk mund ta aksesoj atë.",lost_or_stolen_phone
Kam humbur telefonin tim. A mund ta përdor kartën time pa aplikacion?,lost_or_stolen_phone
Çfarë duhet të bëj nëse telefoni im inteligjent humbet ose vidhet?,lost_or_stolen_phone
"Nëse kam humbur telefonin tim, çfarë hapash duhet të ndërmarr për të ndaluar dikë që të përdorë llogarinë time?",lost_or_stolen_phone
A mund të përdorë dikush tjetër llogarinë time nëse ka telefonin tim? e humba timen.,lost_or_stolen_phone
"Më vodhën telefonin, ndihmë!",lost_or_stolen_phone
"telefoni është zhdukur, çfarë duhet të bëj",lost_or_stolen_phone
"Aktualisht nuk e posedoj telefonin tim, a është ende e mundur t'i zgjidh gjërat normalisht pa akses në aplikacion?",lost_or_stolen_phone
Kam humbur telefonin tim. A mund ta çaktivizoj aplikacionin?,lost_or_stolen_phone
"telefoni është zhdukur, nuk dua që të tjerët të kenë akses në informacionin e llogarisë",lost_or_stolen_phone
A ka diçka që mund të bëj pasi telefoni im më vodhën dje?,lost_or_stolen_phone
Unë mendoj se telefoni im është vjedhur. Çfarë mund të bëj?,lost_or_stolen_phone
A është e mundur të hyj në telefonin tim nga hoteli/,lost_or_stolen_phone
Kam humbur telefonin tim. Çfarë duhet të bëj?,lost_or_stolen_phone
Dikush ma ka marrë telefonin nga dhoma ime e hotelit!,lost_or_stolen_phone
A mund të më aksesojë llogaria ime nga një hajdut? Unë u grabita.,lost_or_stolen_phone
Telefoni im mungon ose më është vjedhur.,lost_or_stolen_phone
"E kam vendosur gabim telefonin, kështu që nuk mund ta përdor aplikacionin! A do të thotë kjo që nuk mund ta përdor kartën time?",lost_or_stolen_phone
"E lashë telefonin në hotelin ku po qëndroja, kështu që nuk mund ta përdor aplikacionin!",lost_or_stolen_phone
"Telefoni im është vjedhur dje, a mund të më ndihmoni për këtë?",lost_or_stolen_phone
Kohët e fundit më kanë grabitur dhe do të doja të dija nëse duhet të kem akses në aplikacion për të përdorur shërbimet e tua dhe si do të bëja të konfiguroja shërbimet e tua në një pajisje të re që i përket një përdoruesi aktual?,lost_or_stolen_phone
Telefoni im është në hotel. Si mund ta përdor aplikacionin?,lost_or_stolen_phone
Kartat e mia janë vjedhur,lost_or_stolen_phone
Telefoni im është humbur ose vjedhur,lost_or_stolen_phone
telefonin tim e ka vjedhur dikush,lost_or_stolen_phone
Çfarë duhet të bëj nëse dikush më ka vjedhur telefonin?,lost_or_stolen_phone
Telefoni im është vjedhur. Si mund të sigurohem që askush nuk e përdor llogarinë time prej saj?,lost_or_stolen_phone
A mund t'i përdor shërbimet tuaja pa qasje në aplikacion?,lost_or_stolen_phone
Unë u grabita. Ata morën gjithçka. Nuk mund ta përdor aplikacionin. Çfarë të bëj?,lost_or_stolen_phone
Si ta mbroj telefonin tim nga dikush që e përdor pasi e kam humbur.,lost_or_stolen_phone
